{
  "product_key": "sgodozglgymucvq2",
  "name": "Tesla Smart AIR PURIFIER mini",
  "manufacturer": "Tesla Smart",
  "model": "Air Purifier Mini",
  "protocol_version": "3.3",
  "category": "air_purifier",
  "entities": [
    {
      "platform": "switch",
      "id": 1,
      "friendly_name": "Power",
      "restore_on_reconnect": false
    },
    {
      "platform": "switch",
      "id": 6,
      "friendly_name": "Ionizer",
      "restore_on_reconnect": false
    },
    {
      "platform": "switch",
      "id": 8,
      "friendly_name": "Light",
      "restore_on_reconnect": false
    },
    {
      "platform": "select",
      "id": 4,
      "friendly_name": "Fan Speed",
      "select_options": "sleep;auto;mid;high",
      "select_options_friendly": "Sleep;Auto;Medium;High",
      "restore_on_reconnect": false
    },
    {
      "platform": "sensor",
      "id": 5,
      "friendly_name": "Filter Life",
      "device_class": "battery",
      "unit_of_measurement": "%"
    },
    {
      "platform": "select",
      "id": 18,
      "friendly_name": "Timer",
      "select_options": "cancel;1h;2h;4h",
      "select_options_friendly": "Off;1 hour;2 hours;4 hours",
      "restore_on_reconnect": false
    }
  ],
  "contributed_by": "BildaSystem.cz",
  "tested": true
}
