{
  "product_key": "keyjup78v54myhan",
  "name": "Tesla Smart Power Strip PS300",
  "manufacturer": "Tesla Smart",
  "model": "PS300",
  "protocol_version": "3.4",
  "category": "switch",
  "entities": [
    {"platform": "switch", "id": 1, "friendly_name": "USB", "restore_on_reconnect": false},
    {"platform": "switch", "id": 2, "friendly_name": "Outlet 1", "restore_on_reconnect": false},
    {"platform": "switch", "id": 3, "friendly_name": "Outlet 2", "restore_on_reconnect": false},
    {"platform": "switch", "id": 4, "friendly_name": "Outlet 3", "restore_on_reconnect": false},
    {"platform": "switch", "id": 5, "friendly_name": "Outlet 4", "restore_on_reconnect": false},
    {"platform": "sensor", "id": 18, "friendly_name": "Current", "device_class": "current", "unit_of_measurement": "mA", "scaling": 0.1},
    {"platform": "sensor", "id": 19, "friendly_name": "Power", "device_class": "power", "unit_of_measurement": "W", "scaling": 0.1},
    {"platform": "sensor", "id": 20, "friendly_name": "Voltage", "device_class": "voltage", "unit_of_measurement": "V", "scaling": 0.1}
  ],
  "contributed_by": "BildaSystem.cz",
  "tested": true
}
